{"pageProps":{"title":"Vue Computed Values","publishedAt":"12.02.2022","published":true,"thumbnail":"/personal-blog/articles/vue-computed/vue-hero-752SHZLC.png","tags":["javascript","vue","reactivity"],"description":"That is my first article, where I describe everything right away. Withou any hesitation in the end, so to speak. Feel free to ask any question. Great !","slug":"vue-computed","body":"var Component=(()=>{var J=Object.create;var q=Object.defineProperty;var U=Object.getOwnPropertyDescriptor;var S=Object.getOwnPropertyNames;var L=Object.getPrototypeOf,F=Object.prototype.hasOwnProperty;var b=o=>q(o,\"__esModule\",{value:!0});var E=(o,i)=>()=>(i||o((i={exports:{}}).exports,i),i.exports),W=(o,i)=>{for(var s in i)q(o,s,{get:i[s],enumerable:!0})},t=(o,i,s,a)=>{if(i&&typeof i==\"object\"||typeof i==\"function\")for(let n of S(i))!F.call(o,n)&&(s||n!==\"default\")&&q(o,n,{get:()=>i[n],enumerable:!(a=U(i,n))||a.enumerable});return o},y=(o,i)=>t(b(q(o!=null?J(L(o)):{},\"default\",!i&&o&&o.__esModule?{get:()=>o.default,enumerable:!0}:{value:o,enumerable:!0})),o),K=(o=>(i,s)=>o&&o.get(i)||(s=t(b({}),i,1),o&&o.set(i,s),s))(typeof WeakMap!=\"undefined\"?new WeakMap:0);var l=E((M,f)=>{f.exports=_jsx_runtime});var w={};W(w,{default:()=>j,frontMatter:()=>P});var e=y(l());var r=\"/personal-blog/articles/vue-computed/vue-hero-752SHZLC.png\";var p=\"/personal-blog/articles/vue-computed/vue-component-35PEML2M.png\";var Q=\"/personal-blog/articles/vue-computed/constant-E5QY52BY.jpg\";var T=`<template>\\r\n    <div>\\r\n        {{ foo }}\\r\n    </div>\\r\n</template>\\r\n\\r\n<script>\\r\nexport default {\\r\n  data() {\\r\n    return {\\r\n        foo: 'hello'\\r\n        };\\r\n    },\\r\n}\\r\n<\\/script>\\r\n\\r\n<style>\\r\n.foo {\\r\n    background: green;\\r\n}\\r\n</style>`;var P={title:\"Vue Computed Values\",publishedAt:\"12.02.2022\",published:!0,thumbnail:r,tags:[\"javascript\",\"vue\",\"reactivity\"],description:\"That is my first article, where I describe everything right away. Withou any hesitation in the end, so to speak. Feel free to ask any question. Great !\"};function R(o={}){let{wrapper:i}=o.components||{};return i?(0,e.jsx)(i,Object.assign({},o,{children:(0,e.jsx)(s,{})})):s();function s(){let a=Object.assign({h1:\"h1\",blockquote:\"blockquote\",p:\"p\",ul:\"ul\",li:\"li\"},o.components),{ArticleImage:n,SectionHeader:u,Code:c}=a;return n||m(\"ArticleImage\",!0),c||m(\"Code\",!0),u||m(\"SectionHeader\",!0),(0,e.jsxs)(e.Fragment,{children:[(0,e.jsx)(a.h1,{children:\"Vue reactivity computed\"}),`\n`,(0,e.jsxs)(a.blockquote,{children:[`\n`,(0,e.jsx)(a.p,{children:\"That is my first article on Vue reactiry where I'm going to explain complex terms in a plaine language, regardles of the previous background in programming.\"}),`\n`]}),`\n`,(0,e.jsx)(a.p,{children:\"At the beginning, I need to mention that there exist a lot of fancy JS-based frameworks. However, React remains the most popular one regardless of the competition on that market that has intensified dramatically over the years.\"}),`\n`,(0,e.jsx)(n,{src:r,alt:\"alt1\"}),`\n`,(0,e.jsx)(a.p,{children:\"At the beginning, I need to mention that there exist a lot of fancy JS-based frameworks. However, React remains the most popular one regardless of the competition on that market that has intensified dramatically over the years.\"}),`\n`,(0,e.jsx)(u,{title:\"Never Give Up\",id:\"1\",children:(0,e.jsx)(a.p,{children:\"Never Give up\"})}),`\n`,(0,e.jsxs)(a.ul,{children:[`\n`,(0,e.jsx)(a.li,{children:\"When everything tumbles down in front of you, don't yield to the pressure.\"}),`\n`,(0,e.jsx)(a.li,{children:\"YOU MUST RESIST DESPITE EVERYTHING !\"}),`\n`]}),`\n`,(0,e.jsx)(a.p,{children:\"Lorem ipsum dolor sit amet consectetur adipisicing elit. Eveniet maxime eos labore, eum harum recusandae voluptate architecto obcaecati iusto. Omnis at eveniet reiciendis corrupti magni quidem, voluptas neque dolorem ullam vitae impedit libero veritatis quas quaerat voluptatibus asperiores distinctio dignissimos ipsum mollitia error? Blanditiis itaque culpa debitis perferendis natus sapiente!\"}),`\n`,(0,e.jsx)(a.p,{children:\"Lorem ipsum dolor sit amet consectetur adipisicing elit. Assumenda quidem mollitia possimus ipsa numquam dignissimos soluta! Repellendus itaque praesentium nostrum natus, est voluptates, neque iusto quas quaerat\"}),`\n`,(0,e.jsx)(a.p,{children:\"eligendi facere id adipisci. Aliquam perspiciatis laboriosam deleniti, in ipsam dolor officiis numquam eveniet dolorum. Iusto quos adipisci at pariatur delectus facilis, deserunt ea, maxime ipsam consectetur voluptas, eligendi totam. Quos asperiores repellat a, consequuntur doloribus iure sed non ducimus voluptatem, distinctio qui? Odit tempore explicabo, recusandae quia natus harum temporibus et reprehenderit enim quo molestiae impedit quod laborum commodi cum reiciendis vel minima nulla officiis ipsa non dolorem perspiciatis. Vero, animi eum!\"}),`\n`,(0,e.jsx)(a.p,{children:\"Lorem ipsum dolor sit amet consectetur adipisicing elit. Harum laborum corrupti magni vero qui voluptas maiores provident inventore consequuntur ullam enim, tenetur autem alias. Modi quod laudantium fugit ullam ipsa? Minima dolorum et dolorem ipsam, ipsa magni corporis sapiente eveniet. Quos quam modi fugiat assumenda aut maxime, consequatur ex impedit alias soluta officia tempore, sunt totam. Aperiam sapiente vero quod commodi praesentium fugiat provident dicta laudantium dolorem. Eaque vitae corporis doloremque necessitatibus sunt cum quidem provident hic sed consectetur, vel laborum atque animi. Exercitationem sit, facilis blanditiis ipsam laudantium magni eaque optio aspernatur neque labore provident quod voluptatem iusto eligendi aliquam. Tempora eum quos est, cum soluta voluptatibus amet animi, nihil eaque doloribus tenetur velit mollitia enim tempore saepe commodi, quisquam voluptate dolores aut aperiam nisi id libero? Et amet tempora numquam consequuntur eligendi blanditiis in maiores facere obcaecati nisi? Distinctio amet suscipit perferendis sed sit minima natus a nihil, eos saepe? Quo blanditiis alias similique cupiditate odit obcaecati minus, maxime voluptates id, labore modi ex non. Eveniet, nobis? Ipsum, esse rerum. Ex repellat laborum inventore eum quasi eius numquam. Ratione illo voluptates repudiandae? Quas veniam voluptatum, deserunt fuga animi quae reprehenderit modi nesciunt provident dignissimos quod doloremque. Fuga necessitatibus neque, ex aspernatur corporis quae maxime id at aliquam a provident error blanditiis, reiciendis dolores fugit repellendus? Obcaecati reiciendis omnis vel quasi magni fuga nostrum provident suscipit placeat et doloremque libero exercitationem blanditiis laborum, quaerat error aliquid eveniet, veniam illum tempore repellendus impedit explicabo nam! Quod perspiciatis omnis dolores illo explicabo nihil maiores quis accusamus enim voluptatem consectetur, maxime aperiam hic praesentium? Dolorem voluptas natus provident qui ullam exercitationem nisi, ex molestiae asperiores id atque placeat? Culpa, numquam enim tempore quae, aspernatur dolorum mollitia doloribus facilis sunt fugit tenetur corporis. Mollitia, consequuntur! At ut sed illo voluptatem! Aut magnam vel assumenda rem, tenetur iure deserunt ea voluptatibus quidem. Qui recusandae repellendus nemo libero maxime natus sit cupiditate, amet id. Incidunt, doloribus? Recusandae nam eveniet a. Tempore illo sapiente consectetur ab ducimus, quam laudantium sit atque. Saepe ipsam corporis quae vitae ipsum qui iure reiciendis vel soluta unde culpa similique eum eligendi ipsa veniam aut fugiat aliquid expedita, minus, accusantium impedit cumque quo in enim. Nesciunt commodi, ducimus saepe dolores blanditiis perferendis nam ut accusamus aliquam aut provident dolorem eaque consequuntur unde quo? Repudiandae nisi odit expedita qui laborum inventore illum ipsam pariatur, ullam quo illo alias quas! Atque mollitia tempore minima tempora pariatur facilis fugiat, saepe tenetur, laudantium consequuntur corrupti illo cumque unde, eaque quia perferendis adipisci nulla! Quod, tenetur! Reprehenderit nemo corrupti, illo aut amet assumenda, natus, distinctio enim qui incidunt provident reiciendis sit sed. Commodi repudiandae dolorum quod soluta architecto enim velit ut atque dignissimos aut magnam nemo praesentium esse voluptates delectus, labore animi molestiae minima, expedita numquam libero eligendi adipisci. Reprehenderit, tempore. Placeat accusamus voluptas dolorem debitis! Explicabo, eius, officiis voluptatum cupiditate deleniti molestiae magnam deserunt debitis magni minus a eveniet velit. Enim omnis voluptatem eius facilis cum iusto unde in iste voluptas iure consequuntur at et expedita laborum velit eos voluptatum, atque aspernatur nostrum, perspiciatis magnam deleniti illo voluptatibus quos! Rem, voluptatibus neque. Culpa earum fuga minima reprehenderit, nemo cupiditate natus quasi ipsa voluptates sapiente, dolorum quaerat adipisci odit mollitia quam numquam exercitationem. Corporis obcaecati rem recusandae dolorem consectetur perspiciatis ipsam doloremque? Omnis accusamus, totam, impedit vero labore beatae earum deserunt eius quas quaerat ex expedita! Corrupti aperiam dolorum cupiditate fugiat doloribus nihil repudiandae, ea accusantium consectetur consequuntur commodi totam deleniti est, illo sed? Architecto, quas reiciendis ad sequi, libero vero aliquam mollitia ipsam sed quod autem reprehenderit corporis itaque, nostrum veritatis quidem facilis. Maxime blanditiis dolore inventore est ea laudantium sunt cupiditate, cum aliquid consequatur. Ratione cum numquam obcaecati iste nesciunt modi! Voluptate magni minus ducimus quae esse aliquid adipisci officiis laudantium dicta fugiat ex explicabo, itaque minima molestiae sapiente, atque eum id quibusdam neque nemo quis. Molestiae mollitia, impedit voluptate quo unde aperiam, optio fugit maiores, est ullam alias dicta sunt obcaecati recusandae aspernatur tenetur omnis incidunt rem expedita nisi veritatis aliquid. Qui, nemo consequuntur iure dolores optio accusantium sunt fuga voluptatem ducimus nesciunt, unde inventore corporis voluptatibus dolorum veniam sit mollitia rerum. Eaque animi quo, expedita rerum optio iusto repellat tempora ab architecto, unde atque quia alias voluptatibus! Ad, minima deleniti distinctio quos quod sed voluptatibus numquam nobis necessitatibus dolorem dicta consectetur possimus perferendis repellat debitis eum deserunt qui velit vel hic quam corporis perspiciatis? Consequatur reprehenderit natus ullam rem unde alias commodi est nemo vel fugit neque a et minima, sunt repellendus debitis placeat nulla atque odit accusamus expedita nisi! Temporibus, a dolorum dolorem minus labore unde veritatis repudiandae sint neque doloremque fugit consequatur autem quasi ad tenetur provident maxime eligendi saepe, ut ea consectetur adipisci? Doloribus, sit? Eveniet eos, suscipit accusamus voluptatem magni, maiores quos a, dicta obcaecati quaerat soluta! Illo recusandae est totam sapiente laborum assumenda! Minus magnam ex libero vitae corporis velit repellat sed maiores in laborum quos neque, dignissimos earum est cumque quia odit aliquid eos saepe, cupiditate voluptatem iusto sapiente? Ratione, odit tempore! Doloremque repudiandae distinctio facilis, quam dolorem, nam eligendi velit nostrum porro sed rem quisquam! Consequatur repudiandae explicabo placeat iusto voluptatem laborum, aliquam doloremque, quia laudantium iste, tempore nesciunt tenetur illum optio debitis autem ea ex culpa eligendi nemo voluptatum ullam! Assumenda sit quasi iure officiis nam necessitatibus aliquid molestias corrupti consequuntur esse ut reiciendis, amet aperiam fugiat sapiente numquam nisi laborum sunt. Doloremque eos qui assumenda nulla cupiditate ex? Commodi tenetur reprehenderit similique eos distinctio nihil voluptatem omnis repellat iste dolores vero quasi, esse, minima repellendus modi atque eaque ut labore itaque dicta hic! Quidem incidunt dicta necessitatibus debitis inventore nisi, a ipsam fuga soluta quas natus minus vel vero tempora ipsum vitae tenetur, beatae doloribus accusamus amet illo pariatur. Ea, rerum alias. Voluptates, ab suscipit porro quasi possimus doloremque nulla cupiditate facere saepe corrupti rerum quae tenetur sit quisquam nostrum, sunt perspiciatis aspernatur debitis laborum! Quibusdam, ratione fuga sint debitis quis distinctio quae. Consectetur officia ut sapiente libero officiis id error dolores impedit!\"}),`\n`,(0,e.jsx)(c,{language:\"javascript\",children:T}),`\n`,(0,e.jsx)(u,{title:\"New Frontier\",id:\"2\",children:(0,e.jsx)(a.p,{children:\"New Frontier\"})}),`\n`,(0,e.jsx)(a.p,{children:\"Lorem ipsum dolor sit amet consectetur adipisicing elit. Numquam illo provident possimus veritatis expedita perspiciatis maiores nemo nam similique reiciendis ab, totam adipisci voluptate sint pariatur quod fuga vero illum!\"}),`\n`,(0,e.jsx)(a.p,{children:\"Lorem ipsum dolor sit, amet consectetur adipisicing elit. Cupiditate fuga voluptates ullam vel quam harum quas autem perspiciatis. Vero iste accusantium ipsum quaerat mollitia pariatur optio, cumque aperiam facilis obcaecati?\"}),`\n`,(0,e.jsx)(a.p,{children:\"Lorem ipsum dolor sit amet consectetur adipisicing elit. Minus officia mollitia doloremque reiciendis sequi deleniti sunt, qui, iusto, nisi laboriosam consequuntur eius tempore ad quam. Quibusdam itaque vero totam ipsum accusamus laudantium magni recusandae officiis quasi aliquid doloribus tempore, quas omnis pariatur, nisi necessitatibus eos laborum placeat eum distinctio dolorum!\"}),`\n`,(0,e.jsx)(u,{title:\"Manslaughter\",id:\"3\",children:(0,e.jsx)(a.p,{children:\"Manslaughter without malice aforethought :)\"})}),`\n`,(0,e.jsx)(a.p,{children:\"Lorem ipsum dolor sit amet consectetur adipisicing elit. Numquam illo provident possimus veritatis expedita perspiciatis maiores nemo nam similique reiciendis ab, totam adipisci voluptate sint pariatur quod fuga vero illum!\"}),`\n`,(0,e.jsx)(a.p,{children:\"Lorem ipsum dolor sit, amet consectetur adipisicing elit. Cupiditate fuga voluptates ullam vel quam harum quas autem perspiciatis. Vero iste accusantium ipsum quaerat mollitia pariatur optio, cumque aperiam facilis obcaecati?\"}),`\n`,(0,e.jsx)(a.p,{children:\"Lorem ipsum dolor sit amet consectetur adipisicing elit. Minus officia mollitia doloremque reiciendis sequi deleniti sunt, qui, iusto, nisi laboriosam consequuntur eius tempore ad quam. Quibusdam itaque vero totam ipsum accusamus laudantium magni recusandae officiis quasi aliquid doloribus tempore, quas omnis pariatur, nisi necessitatibus eos laborum placeat eum distinctio dolorum!\"}),`\n`,(0,e.jsx)(n,{src:p,alt:\"alt1\"}),`\n`,(0,e.jsx)(n,{src:Q,alt:\"alt1\"})]})}}var j=R;function m(o,i){throw new Error(\"Expected \"+(i?\"component\":\"object\")+\" `\"+o+\"` to be defined: you likely forgot to import, pass, or provide it.\")}return K(w);})();\n;return Component;"},"__N_SSG":true}